{"schema_status":"provisional-m2-json-compatible-yaml","version":"0.2.0","updated_on":"2026-08-24","scope":"fixture","provisional_limits":{"status":"provisional"},"lexical_policy":{"status":"fixture"},"m3_handover":[],"units":[{"unit_id":"unit-01","title":"fixture","purpose":"構造検査","prerequisites":[],"new_skills":["orth.fixture.recognize"],"review_skills":[],"skill_treatments":[],"lexical_requirements":{"categories":[],"candidate_lemmas":[],"formal_vocabulary":false},"provisional_new_lexeme_limit":0,"provisional_new_skill_limit":1,"sentence_complexity_limit":{"max_tokens":1},"required_exercise_types":[],"cumulative_reading_spec":{},"exit_criteria":["構造検査"],"next_units":[],"evidence_refs":["design:DEC-0011"],"review":{"source_checked":false,"editorial_approved":false,"expert_reviewed":false},"subunit_ids":["unit-01a"]}],"subunits":[{"unit_id":"unit-01a","parent_unit":"unit-01","title":"fixture","purpose":"構造検査","prerequisites":[],"new_skills":["orth.fixture.recognize"],"review_skills":[],"skill_treatments":[],"lexical_requirements":{"categories":[],"candidate_lemmas":[],"formal_vocabulary":false},"provisional_new_lexeme_limit":0,"provisional_new_skill_limit":1,"sentence_complexity_limit":{"max_tokens":1},"required_exercise_types":[],"cumulative_reading_spec":{},"exit_criteria":["構造検査"],"next_units":[],"evidence_refs":["design:DEC-0011"],"review":{"source_checked":false,"editorial_approved":false,"expert_reviewed":false}}],"review_schedule":[{"cohort":"unit-01a","skill_ids":["orth.fixture.recognize"],"introduced_at":"unit-01a","guided_at":"unit-01a","next_reuse":null,"spaced_review":null,"cumulative_use":"unit-01a","exit_assessment":"unit-01a"}]}
